{"schemaVersion":"session-snapshot/v1","mediaType":"application/vnd.coslash.session-snapshot.v1+json","collectorVersion":"0.1.0","agent":"claude","sourceSessionId":"claude-fixture-1","sessionStartedAtMs":1700001000000,"contentHash":"sha256:36e2dcf5b9029c1cc5fdbe894ef7476f6dbf6f2a07834ac8222a54af7a00ed9a","repository":{"canonical":"local-project","localOnly":true},"truncation":[],"redactions":[],"session":{"name":"Review contract","lastActivityAtMs":1700001001000,"counts":{"editedFiles":0,"turns":1,"toolUses":0,"errors":0,"compactions":0,"commands":0,"pullRequests":0},"usage":{"models":[],"estimatedCostMicroUsd":0,"unpricedModels":["unknown-model"]},"digest":[],"todos":[],"fileEdits":[],"commits":[],"subagents":[]}}