{"schemaVersion":"session-snapshot/v1","mediaType":"application/vnd.coslash.session-snapshot.v1+json","collectorVersion":"0.1.0","agent":"codex","sourceSessionId":"codex-fixture-1","sessionStartedAtMs":1700000000000,"contentHash":"sha256:dcd01ddadfbd397c3d216b6a6beeb4c82ad5eb1c0e8ae92166be070bcfc92d8b","repository":{"canonical":"github.com/centauri-ai/coslash","localOnly":false},"truncation":[],"redactions":[],"session":{"name":"Implement snapshot export","summary":"Contract and redaction boundary implemented.","cwd":"collector","branch":"feature/eng-1340","durationMs":120000,"lastActivityAtMs":1700000120000,"model":"gpt-5","declaredGoal":"Ship an explicit export allow-list.","firstPrompt":"Implement ENG-1340 without exposing raw commands.","counts":{"editedFiles":2,"turns":3,"toolUses":4,"errors":0,"compactions":0,"commands":2,"pullRequests":0},"usage":{"models":[{"model":"gpt-5","inputTokens":1000,"outputTokens":200,"cacheCreationInputTokens":0,"cacheCreation1hInputTokens":0,"cacheReadInputTokens":0,"estimatedCostMicroUsd":250000}],"estimatedCostMicroUsd":250000,"unpricedModels":[]},"digest":[{"turn":1,"category":"user","description":"Requested a bounded export contract."}],"todos":[{"text":"Run compatibility fixtures","done":true}],"fileEdits":[{"path":"collector/snapshot/v1/snapshot.go","additions":100,"deletions":0,"edits":1,"isNew":true}],"commits":["feat: add snapshot v1 contract"],"commitShas":["aaaaaaaaaaaaaaaaaaaaaaaaaaaaaaaaaaaaaaaa"],"subagents":[]}}